{
    "$schema": "http://json-schema.org/schema#",
    "properties": {
        "decreased_stat": {
            "anyOf": [
                {
                    "type": "null"
                },
                {
                    "properties": {
                        "name": {
                            "type": "string"
                        },
                        "url": {
                            "type": "string"
                        }
                    },
                    "required": [
                        "name",
                        "url"
                    ],
                    "type": "object"
                }
            ]
        },
        "hates_flavor": {
            "anyOf": [
                {
                    "type": "null"
                },
                {
                    "properties": {
                        "name": {
                            "type": "string"
                        },
                        "url": {
                            "type": "string"
                        }
                    },
                    "required": [
                        "name",
                        "url"
                    ],
                    "type": "object"
                }
            ]
        },
        "id": {
            "type": "integer"
        },
        "increased_stat": {
            "anyOf": [
                {
                    "type": "null"
                },
                {
                    "properties": {
                        "name": {
                            "type": "string"
                        },
                        "url": {
                            "type": "string"
                        }
                    },
                    "required": [
                        "name",
                        "url"
                    ],
                    "type": "object"
                }
            ]
        },
        "likes_flavor": {
            "anyOf": [
                {
                    "type": "null"
                },
                {
                    "properties": {
                        "name": {
                            "type": "string"
                        },
                        "url": {
                            "type": "string"
                        }
                    },
                    "required": [
                        "name",
                        "url"
                    ],
                    "type": "object"
                }
            ]
        },
        "move_battle_style_preferences": {
            "items": {
                "properties": {
                    "high_hp_preference": {
                        "type": "integer"
                    },
                    "low_hp_preference": {
                        "type": "integer"
                    },
                    "move_battle_style": {
                        "properties": {
                            "name": {
                                "type": "string"
                            },
                            "url": {
                                "type": "string"
                            }
                        },
                        "required": [
                            "name",
                            "url"
                        ],
                        "type": "object"
                    }
                },
                "required": [
                    "high_hp_preference",
                    "low_hp_preference",
                    "move_battle_style"
                ],
                "type": "object"
            },
            "type": "array"
        },
        "name": {
            "type": "string"
        },
        "names": {
            "items": {
                "properties": {
                    "language": {
                        "properties": {
                            "name": {
                                "type": "string"
                            },
                            "url": {
                                "type": "string"
                            }
                        },
                        "required": [
                            "name",
                            "url"
                        ],
                        "type": "object"
                    },
                    "name": {
                        "type": "string"
                    }
                },
                "required": [
                    "language",
                    "name"
                ],
                "type": "object"
            },
            "type": "array"
        },
        "pokeathlon_stat_changes": {
            "items": {
                "properties": {
                    "max_change": {
                        "type": "integer"
                    },
                    "pokeathlon_stat": {
                        "properties": {
                            "name": {
                                "type": "string"
                            },
                            "url": {
                                "type": "string"
                            }
                        },
                        "required": [
                            "name",
                            "url"
                        ],
                        "type": "object"
                    }
                },
                "required": [
                    "max_change",
                    "pokeathlon_stat"
                ],
                "type": "object"
            },
            "type": "array"
        }
    },
    "required": [
        "decreased_stat",
        "hates_flavor",
        "id",
        "increased_stat",
        "likes_flavor",
        "move_battle_style_preferences",
        "name",
        "names",
        "pokeathlon_stat_changes"
    ],
    "type": "object"
}