{"name":"hasty","pokeathlon_stat_changes":[{"pokeathlon_stat":{"url":"http:\/\/127.0.0.1:8000\/api\/v2\/pokeathlon-stat\/1\/","name":"speed"},"max_change":2},{"pokeathlon_stat":{"url":"http:\/\/127.0.0.1:8000\/api\/v2\/pokeathlon-stat\/3\/","name":"skill"},"max_change":-2}],"names":[{"name":"\u305b\u3063\u304b\u3061","language":{"url":"http:\/\/127.0.0.1:8000\/api\/v2\/language\/1\/","name":"ja"}},{"name":"\uc131\uae09","language":{"url":"http:\/\/127.0.0.1:8000\/api\/v2\/language\/3\/","name":"ko"}},{"name":"Press\u00e9","language":{"url":"http:\/\/127.0.0.1:8000\/api\/v2\/language\/5\/","name":"fr"}},{"name":"Hastig","language":{"url":"http:\/\/127.0.0.1:8000\/api\/v2\/language\/6\/","name":"de"}},{"name":"Activo","language":{"url":"http:\/\/127.0.0.1:8000\/api\/v2\/language\/7\/","name":"es"}},{"name":"Lesta","language":{"url":"http:\/\/127.0.0.1:8000\/api\/v2\/language\/8\/","name":"it"}},{"name":"Hasty","language":{"url":"http:\/\/127.0.0.1:8000\/api\/v2\/language\/9\/","name":"en"}}],"hates_flavor":{"url":"http:\/\/127.0.0.1:8000\/api\/v2\/berry-flavor\/5\/","name":"sour"},"likes_flavor":{"url":"http:\/\/127.0.0.1:8000\/api\/v2\/berry-flavor\/3\/","name":"sweet"},"decreased_stat":{"url":"http:\/\/127.0.0.1:8000\/api\/v2\/stat\/3\/","name":"defense"},"move_battle_style_preferences":[{"high_hp_preference":58,"low_hp_preference":88,"move_battle_style":{"url":"http:\/\/127.0.0.1:8000\/api\/v2\/move-battle-style\/1\/","name":"attack"}},{"high_hp_preference":37,"low_hp_preference":6,"move_battle_style":{"url":"http:\/\/127.0.0.1:8000\/api\/v2\/move-battle-style\/2\/","name":"defense"}},{"high_hp_preference":5,"low_hp_preference":6,"move_battle_style":{"url":"http:\/\/127.0.0.1:8000\/api\/v2\/move-battle-style\/3\/","name":"support"}}],"id":10,"increased_stat":{"url":"http:\/\/127.0.0.1:8000\/api\/v2\/stat\/6\/","name":"speed"}}
