{"name":"jolly","pokeathlon_stat_changes":[{"pokeathlon_stat":{"url":"http:\/\/127.0.0.1:8000\/api\/v2\/pokeathlon-stat\/1\/","name":"speed"},"max_change":2},{"pokeathlon_stat":{"url":"http:\/\/127.0.0.1:8000\/api\/v2\/pokeathlon-stat\/5\/","name":"jump"},"max_change":-2}],"names":[{"name":"\u3088\u3046\u304d","language":{"url":"http:\/\/127.0.0.1:8000\/api\/v2\/language\/1\/","name":"ja"}},{"name":"\uba85\ub791","language":{"url":"http:\/\/127.0.0.1:8000\/api\/v2\/language\/3\/","name":"ko"}},{"name":"Jovial","language":{"url":"http:\/\/127.0.0.1:8000\/api\/v2\/language\/5\/","name":"fr"}},{"name":"Froh","language":{"url":"http:\/\/127.0.0.1:8000\/api\/v2\/language\/6\/","name":"de"}},{"name":"Alegre","language":{"url":"http:\/\/127.0.0.1:8000\/api\/v2\/language\/7\/","name":"es"}},{"name":"Allegra","language":{"url":"http:\/\/127.0.0.1:8000\/api\/v2\/language\/8\/","name":"it"}},{"name":"Jolly","language":{"url":"http:\/\/127.0.0.1:8000\/api\/v2\/language\/9\/","name":"en"}}],"hates_flavor":{"url":"http:\/\/127.0.0.1:8000\/api\/v2\/berry-flavor\/2\/","name":"dry"},"likes_flavor":{"url":"http:\/\/127.0.0.1:8000\/api\/v2\/berry-flavor\/3\/","name":"sweet"},"decreased_stat":{"url":"http:\/\/127.0.0.1:8000\/api\/v2\/stat\/4\/","name":"special-attack"},"move_battle_style_preferences":[{"high_hp_preference":35,"low_hp_preference":35,"move_battle_style":{"url":"http:\/\/127.0.0.1:8000\/api\/v2\/move-battle-style\/1\/","name":"attack"}},{"high_hp_preference":5,"low_hp_preference":60,"move_battle_style":{"url":"http:\/\/127.0.0.1:8000\/api\/v2\/move-battle-style\/2\/","name":"defense"}},{"high_hp_preference":60,"low_hp_preference":5,"move_battle_style":{"url":"http:\/\/127.0.0.1:8000\/api\/v2\/move-battle-style\/3\/","name":"support"}}],"id":16,"increased_stat":{"url":"http:\/\/127.0.0.1:8000\/api\/v2\/stat\/6\/","name":"speed"}}
